ffff88000c9a0600 1465973871 C Ii:5:093:1 0:8 6 = 02ff0fff 0f00
ffff88000c9a0600 1465973936 S Ii:5:093:1 -115:8 6 <
ffff88000c9a0600 1467317888 C Ii:5:093:1 0:8 6 = 02ff1fff 1f00
ffff88000c9a0600 1467317950 S Ii:5:093:1 -115:8 6 <
ffff88000c9a0600 1467725888 C Ii:5:093:1 0:8 6 = 02ff2fff 2f00
ffff88000c9a0600 1467725931 S Ii:5:093:1 -115:8 6 <
ffff88000c9a0600 1468661905 C Ii:5:093:1 0:8 6 = 02ff3fff 3f00
ffff88000c9a0600 1468661961 S Ii:5:093:1 -115:8 6 <
ffff88000c9a0600 1469429914 C Ii:5:093:1 0:8 6 = 02ff4fff 4f00
ffff88000c9a0600 1469429969 S Ii:5:093:1 -115:8 6 <
ffff88000c9a0600 1470133907 C Ii:5:093:1 0:8 6 = 02ff5fff 5f00
ffff88000c9a0600 1470133948 S Ii:5:093:1 -115:8 6 <
ffff88000c9a0600 1470837931 C Ii:5:093:1 0:8 6 = 02ff6fff 6f00
ffff88000c9a0600 1470837986 S Ii:5:093:1 -115:8 6 <
ffff88000c9a0600 1471445923 C Ii:5:093:1 0:8 6 = 02ff7fff 7f00
ffff88000c9a0600 1471445981 S Ii:5:093:1 -115:8 6 <
ffff88000c9a0600 1472261948 C Ii:5:093:1 0:8 6 = 02ff8fff 8f00
ffff88000c9a0600 1472262007 S Ii:5:093:1 -115:8 6 <
ffff88000c9a0600 1472965956 C Ii:5:093:1 0:8 6 = 02ff9fff 9f00
ffff88000c9a0600 1472966010 S Ii:5:093:1 -115:8 6 <
ffff88000c9a0600 1473621964 C Ii:5:093:1 0:8 6 = 02ffafff af00
ffff88000c9a0600 1473622019 S Ii:5:093:1 -115:8 6 <
ffff88000c9a0600 1474285972 C Ii:5:093:1 0:8 6 = 02ffbfff bf00
ffff88000c9a0600 1474286027 S Ii:5:093:1 -115:8 6 <
ffff88000c9a0600 1474885980 C Ii:5:093:1 0:8 6 = 02ffcfff cf00
ffff88000c9a0600 1474886034 S Ii:5:093:1 -115:8 6 <
ffff88000c9a0600 1475517975 C Ii:5:093:1 0:8 6 = 02ffdfff df00
ffff88000c9a0600 1475518040 S Ii:5:093:1 -115:8 6 <
ffff88000c9a0600 1476333997 C Ii:5:093:1 0:8 6 = 02ffefff ef00
ffff88000c9a0600 1476334055 S Ii:5:093:1 -115:8 6 <
ffff88000c9a0600 1477366011 C Ii:5:093:1 0:8 6 = 02ffffff ff00
ffff88000c9a0600 1477366069 S Ii:5:093:1 -115:8 6 <
ffff88000c9a0600 1478702024 C Ii:5:093:1 0:8 6 = 02ff0fff 0f00
ffff88000c9a0600 1478702081 S Ii:5:093:1 -115:8 6 <
ffff88000c9a0600 1481734061 C Ii:5:093:1 -84:8 0
ffff88000c9a0600 1481746923 S Ii:5:093:1 -115:8 6 <
